{
  "schema_version": "prompt-runtime-compliance-receipt/v1",
  "receipt_id": "prcr/fixture/rtc01-positive",
  "supersedes_receipt_id": null,
  "related_receipt_ids": [],
  "run": {
    "run_id": "run/rtc01/positive",
    "objective_id": "objective/rtc01/local-proof-continuity",
    "started_at": "2026-09-18T12:00:00Z",
    "ended_at": "2026-09-18T12:10:00Z",
    "repository": "EndeavorEverlasting/web-excel-repair-triage",
    "mission_id": "P07-runtime-compliance-pilot"
  },
  "model_config": {
    "provider": "example-provider",
    "model": "example-model",
    "model_revision": null,
    "configuration_id": "cfg-rtc01",
    "configuration_fingerprint": "fp-cfg-rtc01-0001",
    "host_surface": "repository-local-harness"
  },
  "effective_prompt": {
    "prompt_id": "P07",
    "prompt_revision": "rev-abc1234",
    "surface_id": "agent"
  },
  "scenario": {
    "scenario_id": "RTC01",
    "kind": "synthetic",
    "protected_invariants": [
      "PRCR.BOUNDARY.MATERIAL_PUBLICATION",
      "PRCR.BOUNDARY.RECOVERY_REQUIRED",
      "PRCR.BOUNDARY.RECOVERY_OPENED",
      "PRCR.BOUNDARY.FIRST_ACTION_PROGRESS",
      "PRCR.PROOF.NO_PROMOTION_FROM_BLOCKED"
    ],
    "fixture_path": "harness/evals/runtime-compliance/fixtures/rtc01/receipt.pass.v1.json"
  },
  "boundary_events": [
    {
      "boundary_event_id": "BE-001",
      "sequence": 1,
      "occurred_at": "2026-09-18T12:01:00Z",
      "classification_status": "CANONICAL",
      "family_id": "PROVIDER_SERVICE",
      "class_id": "PS_QUOTA_OR_BILLING_LIMIT",
      "materiality": "MATERIAL",
      "side_effect_state": "NONE",
      "publication_ack": "USER_VISIBLE",
      "last_proven_checkpoint": {
        "ref": "repo:sha:e0038eec",
        "summary": "Last validated repository head before the provider path was lost."
      },
      "recovery_sprint": {
        "required": true,
        "opened": true,
        "sprint_id": "RS-001",
        "scope": "Execute the repository-local proof path while the hosted-only gate remains blocked.",
        "outcome": "Local proof executed; hosted gate correctly quiesced as BLOCKED.",
        "first_executable_action_id": "A-001",
        "completion_gate": "Repository-local validation passes on the exact head.",
        "return_condition": "Hosted provider quota restores and the hosted-only gate can run.",
        "preserves_parent_outcome": true
      },
      "summary": "Provider quota limit removed the preferred hosted execution path.",
      "evidence_refs": [
        "EV-001"
      ]
    }
  ],
  "actions": [
    {
      "action_id": "A-001",
      "sequence": 1,
      "boundary_event_id": "BE-001",
      "started_at": "2026-09-18T12:01:30Z",
      "completed_at": "2026-09-18T12:03:30Z",
      "status": "SUCCEEDED",
      "progress_bearing": true,
      "side_effect_state": "NONE",
      "proof_before": "IMPLEMENTED",
      "proof_after": "VALIDATED",
      "target_identity": null,
      "pre_state_fingerprint": null,
      "readback_of_action_id": null,
      "retry_of_action_id": null,
      "idempotency_key": null,
      "summary": "Executed the repository-local proof path after provider loss.",
      "evidence_refs": [
        "EV-002"
      ]
    }
  ],
  "terminal": {
    "state": "QUIESCENT_BLOCKED",
    "reason_code": "UNAVAILABLE_DEPENDENCY",
    "supervisor_synthesized": false,
    "last_proven_checkpoint": {
      "ref": "repo:sha:e0038eec",
      "summary": "Repository-local validation is the strongest proven state."
    },
    "resumption_trigger": "Hosted provider quota resets or credentials are restored.",
    "next_transition": {
      "owner": "P07 / skill-evaluation",
      "action": "Resume the hosted-only gate once provider quota restores.",
      "completion_gate": "Hosted-only gate passes against the exact head."
    },
    "summary": "Local proof complete; hosted-only gate remains a genuine unavailable dependency."
  },
  "violations": [],
  "proof": {
    "strongest_state": "VALIDATED",
    "runtime_observed": false,
    "proof_ceiling": "Repository-local proof only; the hosted-only gate remains BLOCKED and unobserved.",
    "fingerprint": {
      "effective_prompt": "P07@rev-abc1234",
      "governing_contracts": [
        "prompt-runtime-compliance/v1",
        "execution-boundary-taxonomy/v1"
      ],
      "scenario_fixture": "RTC01",
      "evaluator": "prompt-runtime-compliance/v1",
      "model_config": "fp-cfg-rtc01-0001",
      "runtime_host": null
    },
    "checks": [
      {
        "check_id": "CK-001",
        "name": "action:A-001:repository-local-proof",
        "status": "PASS",
        "evidence_refs": [
          "EV-002"
        ]
      },
      {
        "check_id": "CK-002",
        "name": "hosted-only-gate",
        "status": "BLOCKED",
        "evidence_refs": [
          "EV-001"
        ]
      }
    ]
  },
  "regression_linkage": {
    "status": "NONE",
    "incident_source": "none",
    "systemic_threshold_met": false,
    "canonical_owner": null,
    "occurrences": [],
    "regression_link_ids": []
  },
  "evidence": [
    {
      "evidence_id": "EV-001",
      "kind": "provider",
      "ref": "provider:quota-limit-signal",
      "supports": "Provider execution became unavailable via a quota/billing limit."
    },
    {
      "evidence_id": "EV-002",
      "kind": "repository",
      "ref": "repo:local-proof-run",
      "supports": "Repository-local validation path executed successfully on the exact head."
    }
  ],
  "privacy": {
    "raw_transcript_persisted": false,
    "secrets_persisted": false,
    "hidden_reasoning_persisted": false,
    "redaction_count": 0
  },
  "compliance_result": "PASS",
  "occurred_at": "2026-09-18T12:10:05Z"
}
